{
  "name": "omnicad",
  "display_name": "OmniCAD",
  "prompt": "OmniCAD",
  "version": "@auto",
  "description": "DAG-based CAD workflow orchestration engine",
  "logo": " ‚Ėą‚Ėą‚Ėą‚Ėą‚Ėą‚Ėą‚ēó ‚Ėą‚Ėą‚Ėą‚ēó   ‚Ėą‚Ėą‚Ėą‚ēó‚Ėą‚Ėą‚Ėą‚ēó   ‚Ėą‚Ėą‚ēó‚Ėą‚Ėą‚ēó ‚Ėą‚Ėą‚Ėą‚Ėą‚Ėą‚Ėą‚ēó ‚Ėą‚Ėą‚Ėą‚Ėą‚Ėą‚ēó ‚Ėą‚Ėą‚Ėą‚Ėą‚Ėą‚Ėą‚ēó \n‚Ėą‚Ėą‚ēĒ‚ēź‚ēź‚ēź‚Ėą‚Ėą‚ēó‚Ėą‚Ėą‚Ėą‚Ėą‚ēó ‚Ėą‚Ėą‚Ėą‚Ėą‚ēĎ‚Ėą‚Ėą‚Ėą‚Ėą‚ēó  ‚Ėą‚Ėą‚ēĎ‚Ėą‚Ėą‚ēĎ‚Ėą‚Ėą‚ēĒ‚ēź‚ēź‚ēź‚ēź‚ēĚ‚Ėą‚Ėą‚ēĒ‚ēź‚ēź‚Ėą‚Ėą‚ēó‚Ėą‚Ėą‚ēĒ‚ēź‚ēź‚Ėą‚Ėą‚ēó\n‚Ėą‚Ėą‚ēĎ   ‚Ėą‚Ėą‚ēĎ‚Ėą‚Ėą‚ēĒ‚Ėą‚Ėą‚Ėą‚Ėą‚ēĒ‚Ėą‚Ėą‚ēĎ‚Ėą‚Ėą‚ēĒ‚Ėą‚Ėą‚ēó ‚Ėą‚Ėą‚ēĎ‚Ėą‚Ėą‚ēĎ‚Ėą‚Ėą‚ēĎ     ‚Ėą‚Ėą‚Ėą‚Ėą‚Ėą‚Ėą‚Ėą‚ēĎ‚Ėą‚Ėą‚ēĎ  ‚Ėą‚Ėą‚ēĎ\n‚Ėą‚Ėą‚ēĎ   ‚Ėą‚Ėą‚ēĎ‚Ėą‚Ėą‚ēĎ‚ēö‚Ėą‚Ėą‚ēĒ‚ēĚ‚Ėą‚Ėą‚ēĎ‚Ėą‚Ėą‚ēĎ‚ēö‚Ėą‚Ėą‚ēó‚Ėą‚Ėą‚ēĎ‚Ėą‚Ėą‚ēĎ‚Ėą‚Ėą‚ēĎ     ‚Ėą‚Ėą‚ēĒ‚ēź‚ēź‚Ėą‚Ėą‚ēĎ‚Ėą‚Ėą‚ēĎ  ‚Ėą‚Ėą‚ēĎ\n‚ēö‚Ėą‚Ėą‚Ėą‚Ėą‚Ėą‚Ėą‚ēĒ‚ēĚ‚Ėą‚Ėą‚ēĎ ‚ēö‚ēź‚ēĚ ‚Ėą‚Ėą‚ēĎ‚Ėą‚Ėą‚ēĎ ‚ēö‚Ėą‚Ėą‚Ėą‚Ėą‚ēĎ‚Ėą‚Ėą‚ēĎ‚ēö‚Ėą‚Ėą‚Ėą‚Ėą‚Ėą‚Ėą‚ēó‚Ėą‚Ėą‚ēĎ  ‚Ėą‚Ėą‚ēĎ‚Ėą‚Ėą‚Ėą‚Ėą‚Ėą‚Ėą‚ēĒ‚ēĚ\n ‚ēö‚ēź‚ēź‚ēź‚ēź‚ēź‚ēĚ ‚ēö‚ēź‚ēĚ     ‚ēö‚ēź‚ēĚ‚ēö‚ēź‚ēĚ  ‚ēö‚ēź‚ēź‚ēź‚ēĚ‚ēö‚ēź‚ēĚ ‚ēö‚ēź‚ēź‚ēź‚ēź‚ēź‚ēĚ‚ēö‚ēź‚ēĚ  ‚ēö‚ēź‚ēĚ‚ēö‚ēź‚ēź‚ēź‚ēź‚ēź‚ēĚ ",
  "logo_style": "cornflower_blue",
  "border_style": "steel_blue",
  "tagline_style": "light_sky_blue3",
  "box_style": "ROUNDED"
}
